{
  "fileId": "184416a9-ef20-4500-a9c1-f64b87b424a9",
  "sourceUri": "https://storage.blob.core.windows.net/mi-reportdata/published/reports/184416a9-ef20-4500-a9c1-f64b87b424a9?sv=2021-08-06&se=2026-05-15T12%3A00%3A00Z&sr=b&sp=r&sig=example",
  "correlationId": "384416a9-ef20-4500-a9c1-f64b87b424a0",
  "filename": "live_report_2026-05-15.csv"
}
